{"resources":[{"resourceId":"res_d1890eb43a141d85832d190c48af9667a56270ee9f5d340759bffce468fbc7af","repositoryId":"repo_11111111-1111-4111-8111-111111111111","kind":"file","locator":"docs/notes.md"}],"nodes":[{"nodeId":"node_40000000000000000000000000000001","kind":"agent","entityId":"agent_a"},{"nodeId":"node_40000000000000000000000000000002","kind":"resource","entityId":"res_d1890eb43a141d85832d190c48af9667a56270ee9f5d340759bffce468fbc7af"}],"edges":[{"edgeId":"edge_40000000000000000000000000000001","kind":"observed","fromNodeId":"node_40000000000000000000000000000001","toNodeId":"node_40000000000000000000000000000002","dependency":null,"evidenceEventIds":["evt_00000000000000000000000000000042"]}],"targetSnapshots":[]}
