{"resources":[{"resourceId":"res_6b967ca968e10ea05d94e7ad7adf88b3e97b339c9a64a30e8f3ccab1ae6df030","repositoryId":"repo_11111111-1111-4111-8111-111111111111","kind":"symbol","locator":"src/session.ts#typescript:function:createSession"}],"nodes":[{"nodeId":"node_30000000000000000000000000000001","kind":"agent","entityId":"agent_b"},{"nodeId":"node_30000000000000000000000000000002","kind":"task","entityId":"task_consumer"},{"nodeId":"node_30000000000000000000000000000003","kind":"resource","entityId":"res_6b967ca968e10ea05d94e7ad7adf88b3e97b339c9a64a30e8f3ccab1ae6df030"}],"edges":[{"edgeId":"edge_30000000000000000000000000000001","kind":"observed","fromNodeId":"node_30000000000000000000000000000001","toNodeId":"node_30000000000000000000000000000003","dependency":null,"evidenceEventIds":["evt_00000000000000000000000000000071","evt_00000000000000000000000000000072"]},{"edgeId":"edge_30000000000000000000000000000002","kind":"observed","fromNodeId":"node_30000000000000000000000000000002","toNodeId":"node_30000000000000000000000000000003","dependency":null,"evidenceEventIds":["evt_00000000000000000000000000000071","evt_00000000000000000000000000000072"]}],"targetSnapshots":[]}
